{"artifacts":[{"name":"direct-oracle/pathway_oracle.tsv","sha256":"47312d8c65f8c11a70aa53817c605eb1f2b433ec8d4bb4471d3a3f9bf5f99fd5","size_bytes":2212},{"name":"direct-oracle/diagnostics.json","sha256":"9a69551a494f6e74abc2a4f712c415c57886c89e3aab21a5c1162c6d5bb6c215","size_bytes":744},{"name":"toolkit/pathway_results.tsv","sha256":"cdd4c281fd3ce27cc23303f37061dc2befe84402f744eab629329e4804005310","size_bytes":8943}],"assertions":[{"name":"benchmark_execution","observed":"completed","passed":true,"requirement":"fixture, frozen sources, independent oracle, and toolkit route all complete"},{"name":"locked_runtime_identity","observed":{"direct_edgeR":"4.10.0","direct_limma":"3.68.0","direct_r":"4.6.1","toolkit":{"BiocVersion_package":"3.23.1","Bioconductor":"3.23","R":"4.6.1","edgeR":"4.10.0","limma":"3.68.0","tximport":"1.40.0"}},"passed":true,"requirement":"R 4.6.1, edgeR 4.10.0, limma 3.68.0 in private backend scope"},{"name":"exact_pathway_grid_status_and_order","observed":{"expected_rows":30,"grid_equal":true,"observed_rows":30,"status_semantics_valid":true},"passed":true,"requirement":"exact canonical 6-set/5-hypothesis grid with explicit negative-control statuses"},{"name":"tested_method_shape_and_direction_parity","observed":{"direct_rows":20,"key_sets_equal":true,"toolkit_tested_rows":20},"passed":true,"requirement":"identical tested keys, method NGenes, and direction labels"},{"name":"mapping_and_method_metadata_parity","observed":{"mapping_metadata_valid":true,"method_metadata_valid":true,"tested_universe_counts":["16860"]},"passed":true,"requirement":"mapping counts/rates and self-contained/competitive method labels match frozen semantics"},{"name":"p_value_numeric_parity","observed":{"max_absolute_difference":0.0,"max_relative_difference":0.0,"value_count":20,"violations":0},"passed":true,"requirement":"all independent-oracle p_value values satisfy rtol=1e-6 and atol=1e-10"},{"name":"fdr_numeric_parity","observed":{"max_absolute_difference":0.0,"max_relative_difference":0.0,"value_count":20,"violations":0},"passed":true,"requirement":"all independent-oracle fdr values satisfy rtol=1e-6 and atol=1e-10"},{"name":"proportion_down_numeric_parity","observed":{"max_absolute_difference":0.0,"max_relative_difference":0.0,"value_count":8,"violations":0},"passed":true,"requirement":"all independent-oracle proportion_down values satisfy rtol=1e-6 and atol=1e-10"},{"name":"proportion_up_numeric_parity","observed":{"max_absolute_difference":0.0,"max_relative_difference":0.0,"value_count":8,"violations":0},"passed":true,"requirement":"all independent-oracle proportion_up values satisfy rtol=1e-6 and atol=1e-10"},{"name":"correlation_estimate_raw_numeric_parity","observed":{"max_absolute_difference":0.0,"max_relative_difference":0.0,"value_count":4,"violations":0},"passed":true,"requirement":"all independent-oracle correlation_estimate_raw values satisfy rtol=1e-6 and atol=1e-10"},{"name":"correlation_effective_numeric_parity","observed":{"max_absolute_difference":0.0,"max_relative_difference":0.0,"value_count":4,"violations":0},"passed":true,"requirement":"all independent-oracle correlation_effective values satisfy rtol=1e-6 and atol=1e-10"},{"name":"vif_used_numeric_parity","observed":{"max_absolute_difference":0.0,"max_relative_difference":0.0,"value_count":4,"violations":0},"passed":true,"requirement":"all independent-oracle vif_used values satisfy rtol=1e-6 and atol=1e-10"},{"name":"python_bh_parity","observed":{"family_count":5,"family_ids_valid":true,"maximum_absolute_difference":1.0408340855860843e-17,"violations":0},"passed":true,"requirement":"independent Python BH per contrast/method/hypothesis agrees within 1e-12"}],"benchmark_id":"airway-limma-gene-set-same-engine-v1","implementation":[{"name":"run_airway_pathway_oracle.py","sha256":"71f0860b89d84ee03655fcf543c8a59b9d189f1cfd97f1cdf36c03922f60f164","size_bytes":28353},{"name":"common.py","sha256":"387f51946f883b5fbba68000022fcba391f82201863d13db2dc17a0d0cf5bbe6","size_bytes":11961},{"name":"benchmark-report-v1.schema.json","sha256":"dc28a492888e2a2741d4ab2ab4ed9ad47993303f49da23b12cc15fe1d1cac339","size_bytes":2051},{"name":"prepare_airway_fixture.R","sha256":"171b86d07c2cf8d7c5cb4d1f7d279e163faa7f4e97b44b264e7cfb0a17388ef0","size_bytes":2266},{"name":"run_airway_pathway_direct_oracle.R","sha256":"10e4086f2b3d4e94782899911eb86bea53fa075fa67f99476f024b80115a938f","size_bytes":9853},{"name":"edger_backend.py","sha256":"41248d6046cf45867bc72c0107bc76e97c391e5e8f53f4aca21fede01b132a92","size_bytes":51731},{"name":"analysis_contract.py","sha256":"fe38248ad9b4b27e92dab412bae3affd0905eaab2dea622592ea42e75b0feb01","size_bytes":36467},{"name":"gene_sets.py","sha256":"d43cef660d083b9b7da703daac0ea43f2f30b1499a908762374cf2aa3f4179c2","size_bytes":9545},{"name":"edger_ql.R","sha256":"d64b47e7cee55094c2394d0de701f72ccfe629f48c21b00e4bff1fddf6bc6824","size_bytes":59137},{"name":"pathway_tests.R","sha256":"0d0b7ea026ab045db383aafb28d5919ba01dc3767b038acc5999bf950432cead","size_bytes":37853},{"name":"conda-lock.yml","sha256":"7cddb25b11bdd7d31a5dee156cfd2f8c456398005f3b2acc6c23d5df99e5b702","size_bytes":54784},{"name":"renv.lock","sha256":"8d8ca4c7b9ab411150f207846d098cad799dcefe7219696a06e3ebf17cbe19ff","size_bytes":268638},{"name":"environment.p0.yml","sha256":"b800e0300e79f4a535b1eef195cff2554630d6a9fa5b42de399cd2bf7502094f","size_bytes":333},{"name":"r-sources.lock","sha256":"0632d66bd4aee5cc00e7ee33f6061df0db3803843bd5bc98a91fb83c82e30f4d","size_bytes":1312},{"name":"verify.R","sha256":"0f13c98256143ae1febcb3750cd96b1c9d897d8a5cdfee1481018e12b1fc3a7e","size_bytes":8494}],"inputs":[{"name":"airway/DESCRIPTION","sha256":"cabcacf8d885f119560c3551dde820ea75e184f79975b59a083b754907d9f57b","size_bytes":1508},{"name":"fixture/counts.tsv","sha256":"407b9f8dfe619580b3b0bbaa0464aad7943e10deff4bae0e57c8a42f63ba5bb6","size_bytes":2287691},{"name":"fixture/metadata.tsv","sha256":"e87ad41f1603cc31922ee1a6abd0e9e23a4ad76614668b1c723084b9a5ed946c","size_bytes":209},{"name":"fixture/fixture.json","sha256":"ba0a009b709413a0b3399cb4a682157c21bb66c16bb53e1bb50acbd191265115","size_bytes":267},{"name":"fixture/sets.gmt","sha256":"bb8f7674652dd3f74bce32e8ccb50a737a69bec5dffea782d27b2f4ae367bef3","size_bytes":2945},{"name":"fixture/annotation.tsv","sha256":"05a76394c2fa9d5ac14b7a26d51db1ce5e2123808d1cc121cda9ccd187ad16b4","size_bytes":1782971},{"name":"fixture/gene-set-source.json","sha256":"950adc4a4186c09ff1b74049420ff16030a864baef41991e23f5e10db1909fdd","size_bytes":861}],"metrics":{"bh_parity":{"family_count":5,"family_ids_valid":true,"maximum_absolute_difference":1.0408340855860843e-17,"violations":0},"gene_set_count":6,"not_tested_pathway_row_count":10,"numeric_parity":{"correlation_effective":{"max_absolute_difference":0.0,"max_relative_difference":0.0,"value_count":4,"violations":0},"correlation_estimate_raw":{"max_absolute_difference":0.0,"max_relative_difference":0.0,"value_count":4,"violations":0},"fdr":{"max_absolute_difference":0.0,"max_relative_difference":0.0,"value_count":20,"violations":0},"p_value":{"max_absolute_difference":0.0,"max_relative_difference":0.0,"value_count":20,"violations":0},"proportion_down":{"max_absolute_difference":0.0,"max_relative_difference":0.0,"value_count":8,"violations":0},"proportion_up":{"max_absolute_difference":0.0,"max_relative_difference":0.0,"value_count":8,"violations":0},"vif_used":{"max_absolute_difference":0.0,"max_relative_difference":0.0,"value_count":4,"violations":0}},"pathway_row_count":30,"scope":"backend_kernel_pathway","tested_pathway_row_count":20},"runtime":{"airway":"1.32.0","edgeR":"4.10.0","limma":"3.68.0","python":"3.12.12","r":"4.6.1","r_library_identity":"exact_package_versions_recorded_below","rscript_executable":"Rscript","rscript_sha256":"a09d33dc7b786eb86191e428b3f75406d3a25c5b8fdf8c8e4282d0e55451c331","toolkit_runtime_identity":{"BiocVersion_package":"3.23.1","Bioconductor":"3.23","R":"4.6.1","edgeR":"4.10.0","limma":"3.68.0","tximport":"1.40.0"}},"schema_version":"rnaseq-downstream-benchmark-report-v1","status":"pass","thresholds":{"absolute_tolerance":1e-10,"bh_absolute_tolerance":1e-12,"minimum_tested_genes":10,"mroast_nrot":9999,"mroast_seed":1729,"relative_tolerance":1e-06}}
