{"artifacts":[{"name":"direct-oracle/results.tsv","sha256":"d83a4dbfe00a33546fd5116369d443c6f8f664e1d66330c7d9488ee4fd0eafb8","size_bytes":1794936},{"name":"direct-oracle/coefficients.tsv","sha256":"e8eb3c8e867f17d9729bf49a681af0867782a70ebf3aadcf0e457923b7ddc94f","size_bytes":1837974},{"name":"toolkit/results.tsv","sha256":"986d5cdb96ffeba3ccecf1abf8af6381fe13826276625b09b56a043226b3b4a2","size_bytes":6439547},{"name":"toolkit/coefficients.tsv","sha256":"91fcb08a47718fb9bd73afcb03b40af7c4476ba1215952858f4989193628a49f","size_bytes":16852482},{"name":"toolkit/design.tsv","sha256":"dea28100f11c06058d783f24bc1469ff306dbed8ac5c3c33d1152f40ba08901b","size_bytes":980}],"assertions":[{"name":"benchmark_execution","observed":"completed","passed":true,"requirement":"fixture, direct oracle, and toolkit route all complete"},{"name":"locked_fixture_identity","observed":{"airway_version":"1.32.0","assay":"airway::airway","coefficient":"dextrt","design":"~ cell + dex","factor_levels":{"cell":["N052611","N061011","N080611","N61311"],"dex":["untrt","trt"]},"fixture_id":"airway-1.32.0-cell-plus-dex","gene_count":63677,"sample_count":8},"passed":true,"requirement":"exact airway 1.32.0 integer assay and frozen design identity"},{"name":"locked_backend_identity","observed":{"backend":"edgeR_QL","edgeR":"4.10.0","execution_scope":"backend_kernel_only","r":"4.6.1","runtime_identity":{"BiocVersion_package":"3.23.1","Bioconductor":"3.23","R":"4.6.1","edgeR":"4.10.0","limma":"3.68.0","tximport":"1.40.0"}},"passed":true,"requirement":"R 4.6.1, edgeR 4.10.0, and private backend-kernel scope"},{"name":"tested_gene_set_parity","observed":{"oracle_tested":16860,"toolkit_tested":16860,"unexpected_contrasts":[]},"passed":true,"requirement":"identical tested gene identifiers and one declared contrast"},{"name":"coefficient_shape_parity","observed":{"oracle_columns":["(Intercept)","cellN061011","cellN080611","cellN61311","dextrt"],"oracle_genes":16860,"toolkit_columns":["(Intercept)","cellN061011","cellN080611","cellN61311","dextrt"],"toolkit_genes":16860},"passed":true,"requirement":"identical fitted coefficient columns and gene identifiers"},{"name":"coefficient_numeric_parity","observed":{"max_absolute_difference":0.0,"max_relative_difference":0.0,"violations":0},"passed":true,"requirement":"all fitted coefficients satisfy rtol=1e-6 and atol=1e-10"},{"name":"logfc_numeric_parity","observed":{"max_absolute_difference":0.0,"max_relative_difference":0.0,"value_count":16860,"violations":0},"passed":true,"requirement":"all tested logFC values satisfy rtol=1e-6 and atol=1e-10"},{"name":"pvalue_numeric_parity","observed":{"max_absolute_difference":0.0,"max_relative_difference":0.0,"value_count":16860,"violations":0},"passed":true,"requirement":"all tested PValue values satisfy rtol=1e-6 and atol=1e-10"},{"name":"f_statistic_numeric_parity","observed":{"max_absolute_difference":0.0,"max_relative_difference":0.0,"value_count":16860,"violations":0},"passed":true,"requirement":"all tested F statistics satisfy rtol=1e-6 and atol=1e-10"},{"name":"fdr_numeric_parity","observed":{"max_absolute_difference":0.0,"max_relative_difference":0.0,"value_count":16860,"violations":0},"passed":true,"requirement":"all tested FDR values satisfy rtol=1e-6 and atol=1e-10"}],"benchmark_id":"airway-edger-ql-same-engine-v1","implementation":[{"name":"run_airway_oracle.py","sha256":"aac1c9106e9e89e377914e8154e5391a4163b9451d190b8f9c80f8213133e9b9","size_bytes":20510},{"name":"common.py","sha256":"387f51946f883b5fbba68000022fcba391f82201863d13db2dc17a0d0cf5bbe6","size_bytes":11961},{"name":"benchmark-report-v1.schema.json","sha256":"dc28a492888e2a2741d4ab2ab4ed9ad47993303f49da23b12cc15fe1d1cac339","size_bytes":2051},{"name":"prepare_airway_fixture.R","sha256":"171b86d07c2cf8d7c5cb4d1f7d279e163faa7f4e97b44b264e7cfb0a17388ef0","size_bytes":2266},{"name":"run_airway_direct_oracle.R","sha256":"8591c7d7ec9e04a57dd927406250a6115863766986436a8f60aafdd3922b9996","size_bytes":3588},{"name":"edger_backend.py","sha256":"d99e229d0f941401173cc0519afe33fe07fe5026c0a3d7d1868863d48b7c8840","size_bytes":45788},{"name":"analysis_contract.py","sha256":"fa3f79776e220c1a2e5f8feef7ea504a3e7d6f1601146310077ef3bd84ffae04","size_bytes":35992},{"name":"edger_ql.R","sha256":"02f0eb51a57c5e67502322b9c35111ce0304f1d1bff9ab5455d112952cc3b8c3","size_bytes":56904},{"name":"conda-lock.yml","sha256":"7cddb25b11bdd7d31a5dee156cfd2f8c456398005f3b2acc6c23d5df99e5b702","size_bytes":54784},{"name":"renv.lock","sha256":"8d8ca4c7b9ab411150f207846d098cad799dcefe7219696a06e3ebf17cbe19ff","size_bytes":268638},{"name":"environment.p0.yml","sha256":"b800e0300e79f4a535b1eef195cff2554630d6a9fa5b42de399cd2bf7502094f","size_bytes":333},{"name":"r-sources.lock","sha256":"0632d66bd4aee5cc00e7ee33f6061df0db3803843bd5bc98a91fb83c82e30f4d","size_bytes":1312},{"name":"verify.R","sha256":"0f13c98256143ae1febcb3750cd96b1c9d897d8a5cdfee1481018e12b1fc3a7e","size_bytes":8494}],"inputs":[{"name":"counts.tsv","sha256":"407b9f8dfe619580b3b0bbaa0464aad7943e10deff4bae0e57c8a42f63ba5bb6","size_bytes":2287691},{"name":"metadata.tsv","sha256":"e87ad41f1603cc31922ee1a6abd0e9e23a4ad76614668b1c723084b9a5ed946c","size_bytes":209},{"name":"fixture.json","sha256":"ba0a009b709413a0b3399cb4a682157c21bb66c16bb53e1bb50acbd191265115","size_bytes":267}],"metrics":{"coefficient_max_absolute_difference":0.0,"coefficient_max_relative_difference":0.0,"coefficient_value_count":84300,"f_statistic_max_absolute_difference":0.0,"f_statistic_max_relative_difference":0.0,"f_statistic_value_count":16860,"f_statistic_violations":0,"fdr_max_absolute_difference":0.0,"fdr_max_relative_difference":0.0,"fdr_value_count":16860,"fdr_violations":0,"filtered_gene_count":46817,"input_gene_count":63677,"logfc_max_absolute_difference":0.0,"logfc_max_relative_difference":0.0,"logfc_value_count":16860,"logfc_violations":0,"pvalue_max_absolute_difference":0.0,"pvalue_max_relative_difference":0.0,"pvalue_value_count":16860,"pvalue_violations":0,"scope":"backend_kernel","tested_gene_count":16860},"runtime":{"airway":"1.32.0","edgeR":"4.10.0","python":"3.12.12","r":"4.6.1","r_library_identity":"exact_package_versions_recorded_below","rscript_executable":"Rscript","rscript_sha256":"a09d33dc7b786eb86191e428b3f75406d3a25c5b8fdf8c8e4282d0e55451c331","toolkit_backend":"edgeR_QL","toolkit_runtime_identity":{"BiocVersion_package":"3.23.1","Bioconductor":"3.23","R":"4.6.1","edgeR":"4.10.0","limma":"3.68.0","tximport":"1.40.0"}},"schema_version":"rnaseq-downstream-benchmark-report-v1","status":"pass","thresholds":{"absolute_tolerance":1e-10,"relative_tolerance":1e-06}}
